{
  "name": "sample-name",
  "description": "sample description",
  "type": "default",
  "url": "http://sample.com",
  "image": "http://www.sample.com/image.png",
  "apis": [
    {
      "$ref": "#/definitions/reference1"
    }
  ],
  "maintainer": [
    {
      "name": "fred meyer",
      "twitter": "https://twitter.com/foo",
      "github": "https://github.com/bar"
    }
  ],
  "tags": ["photo", "upload", "marketplace"],
  "definitions": {
    "reference1": {
      "name": "name 1",
      "description": "this can live on a remote URL",
      "image": "http://sample.com/images-1.png",
      "humanURL": "https://sample.com/repository",
      "tags": [ "photos", "reference" ],
      "urls": [
        {
          "type": "portal",
          "url": "https://sample.com/portal"
        },
        {
          "type": "console",
          "url": "https://sample.com/console"
        },
        {
          "type": "X-custom-123",
          "url": "http://sample.com/console"
        }
      ],
      "contact": [
        {
          "type": "twitter",
          "url": "https://sample.com/twitter"
        }
      ],
      "meta": [
        {
          "key": "pricing",
          "value": "Free"
        }
      ]
    }
  }
}